{
  "$schema": "https://json-schema.org/draft/2020-12/schema",
  "type": "object",
  "properties": {
    "bundleVersion": {
      "type": "string",
      "const": "1.0"
    },
    "tool": {
      "type": "object",
      "properties": {
        "name": {
          "type": "string",
          "const": "obelus"
        },
        "version": {
          "type": "string"
        }
      },
      "required": [
        "name",
        "version"
      ],
      "additionalProperties": false
    },
    "pdf": {
      "type": "object",
      "properties": {
        "sha256": {
          "type": "string",
          "pattern": "^[a-f0-9]{64}$"
        },
        "filename": {
          "type": "string"
        },
        "pageCount": {
          "type": "integer",
          "exclusiveMinimum": 0,
          "maximum": 9007199254740991
        }
      },
      "required": [
        "sha256",
        "filename",
        "pageCount"
      ],
      "additionalProperties": false
    },
    "paper": {
      "type": "object",
      "properties": {
        "id": {
          "type": "string",
          "format": "uuid",
          "pattern": "^([0-9a-fA-F]{8}-[0-9a-fA-F]{4}-[1-8][0-9a-fA-F]{3}-[89abAB][0-9a-fA-F]{3}-[0-9a-fA-F]{12}|00000000-0000-0000-0000-000000000000|ffffffff-ffff-ffff-ffff-ffffffffffff)$"
        },
        "title": {
          "type": "string"
        },
        "revision": {
          "type": "integer",
          "exclusiveMinimum": 0,
          "maximum": 9007199254740991
        },
        "createdAt": {
          "type": "string",
          "format": "date-time",
          "pattern": "^(?:(?:\\d\\d[2468][048]|\\d\\d[13579][26]|\\d\\d0[48]|[02468][048]00|[13579][26]00)-02-29|\\d{4}-(?:(?:0[13578]|1[02])-(?:0[1-9]|[12]\\d|3[01])|(?:0[469]|11)-(?:0[1-9]|[12]\\d|30)|(?:02)-(?:0[1-9]|1\\d|2[0-8])))T(?:(?:[01]\\d|2[0-3]):[0-5]\\d(?::[0-5]\\d(?:\\.\\d+)?)?(?:Z))$"
        }
      },
      "required": [
        "id",
        "title",
        "revision",
        "createdAt"
      ],
      "additionalProperties": false
    },
    "annotations": {
      "type": "array",
      "items": {
        "type": "object",
        "properties": {
          "id": {
            "type": "string",
            "format": "uuid",
            "pattern": "^([0-9a-fA-F]{8}-[0-9a-fA-F]{4}-[1-8][0-9a-fA-F]{3}-[89abAB][0-9a-fA-F]{3}-[0-9a-fA-F]{12}|00000000-0000-0000-0000-000000000000|ffffffff-ffff-ffff-ffff-ffffffffffff)$"
          },
          "category": {
            "type": "string",
            "enum": [
              "unclear",
              "wrong",
              "weak-argument",
              "citation-needed",
              "rephrase",
              "praise",
              "enhancement",
              "aside",
              "flag"
            ]
          },
          "quote": {
            "type": "string",
            "minLength": 1
          },
          "contextBefore": {
            "type": "string"
          },
          "contextAfter": {
            "type": "string"
          },
          "page": {
            "type": "integer",
            "exclusiveMinimum": 0,
            "maximum": 9007199254740991
          },
          "bbox": {
            "type": "array",
            "prefixItems": [
              {
                "type": "number"
              },
              {
                "type": "number"
              },
              {
                "type": "number"
              },
              {
                "type": "number"
              }
            ]
          },
          "textItemRange": {
            "type": "object",
            "properties": {
              "start": {
                "type": "array",
                "prefixItems": [
                  {
                    "type": "integer",
                    "minimum": 0,
                    "maximum": 9007199254740991
                  },
                  {
                    "type": "integer",
                    "minimum": 0,
                    "maximum": 9007199254740991
                  }
                ]
              },
              "end": {
                "type": "array",
                "prefixItems": [
                  {
                    "type": "integer",
                    "minimum": 0,
                    "maximum": 9007199254740991
                  },
                  {
                    "type": "integer",
                    "minimum": 0,
                    "maximum": 9007199254740991
                  }
                ]
              }
            },
            "required": [
              "start",
              "end"
            ],
            "additionalProperties": false
          },
          "note": {
            "default": "",
            "type": "string"
          },
          "thread": {
            "default": [],
            "type": "array",
            "items": {
              "type": "object",
              "properties": {
                "at": {
                  "type": "string",
                  "format": "date-time",
                  "pattern": "^(?:(?:\\d\\d[2468][048]|\\d\\d[13579][26]|\\d\\d0[48]|[02468][048]00|[13579][26]00)-02-29|\\d{4}-(?:(?:0[13578]|1[02])-(?:0[1-9]|[12]\\d|3[01])|(?:0[469]|11)-(?:0[1-9]|[12]\\d|30)|(?:02)-(?:0[1-9]|1\\d|2[0-8])))T(?:(?:[01]\\d|2[0-3]):[0-5]\\d(?::[0-5]\\d(?:\\.\\d+)?)?(?:Z))$"
                },
                "body": {
                  "type": "string"
                }
              },
              "required": [
                "at",
                "body"
              ],
              "additionalProperties": false
            }
          },
          "createdAt": {
            "type": "string",
            "format": "date-time",
            "pattern": "^(?:(?:\\d\\d[2468][048]|\\d\\d[13579][26]|\\d\\d0[48]|[02468][048]00|[13579][26]00)-02-29|\\d{4}-(?:(?:0[13578]|1[02])-(?:0[1-9]|[12]\\d|3[01])|(?:0[469]|11)-(?:0[1-9]|[12]\\d|30)|(?:02)-(?:0[1-9]|1\\d|2[0-8])))T(?:(?:[01]\\d|2[0-3]):[0-5]\\d(?::[0-5]\\d(?:\\.\\d+)?)?(?:Z))$"
          },
          "groupId": {
            "type": "string",
            "format": "uuid",
            "pattern": "^([0-9a-fA-F]{8}-[0-9a-fA-F]{4}-[1-8][0-9a-fA-F]{3}-[89abAB][0-9a-fA-F]{3}-[0-9a-fA-F]{12}|00000000-0000-0000-0000-000000000000|ffffffff-ffff-ffff-ffff-ffffffffffff)$"
          }
        },
        "required": [
          "id",
          "category",
          "quote",
          "contextBefore",
          "contextAfter",
          "page",
          "bbox",
          "textItemRange",
          "note",
          "thread",
          "createdAt"
        ],
        "additionalProperties": false
      }
    }
  },
  "required": [
    "bundleVersion",
    "tool",
    "pdf",
    "paper",
    "annotations"
  ],
  "additionalProperties": false
}
